name,text,treatment
women,"Women should have the right to choose to have an abortion.",polarizing
partisanship,"I identify more with the Democratic party than with the Republican party.",polarizing
immigration,"Immigrants today are a burden on our country because they take our jobs, housing and healthcare.",polarizing
books,"Physical books are preferable to e-books for recreational reading.",neutral
cities,"Cities should invest more in parks and green spaces than in large shopping centers.",neutral
cars,"In the future, self-driving cars are preferable to human-driven cars.",neutral
climate_change,"The government should implement stricter regulations to reduce carbon emissions, even if it affects the economy.",polarizing
healthy_eating,"People should be encouraged to eat more fruits and vegetables as part of a healthy diet.",neutral
